{
  "schema_version": "1.0.0",
  "id": "FIX-GOV-001",
  "decision_uri": "author-decision://fixture/FIX-GOV-001",
  "display_code": "FIX-GOV-001",
  "title": "Valid fixture decision",
  "domain": "fixture",
  "workflow_status": "ACCEPTED",
  "canon_status": "PROVISIONAL",
  "scope": "validator fixture only",
  "accepted_on": "2026-08-12",
  "accepted_by": "Author",
  "approval_evidence": "Synthetic validation evidence.",
  "question": "Can a provisional binding decision carry explicit Author evidence?",
  "selection": "Yes, within a synthetic fixture.",
  "alternatives": ["No."],
  "rationale": "Exercises binding-status semantics.",
  "evidence": ["fixture://governance/valid"],
  "consequences": ["No creative canon is created."],
  "affected_sources": ["fixture://governance/valid"],
  "dependencies": [],
  "conflicts": [],
  "residual_unknowns": [],
  "supersedes": [],
  "reopening_conditions": ["Validator contract changes."]
}
